source,type,id,icon,label,description
oh1,action,pebble,false,Pebble,"The Pebble action service allows you to send pins and notifications directly to your Pebble watch."
oh1,action,prowl,false,Prowl,"Prowl lets you use push notifications on iOS devices (please check openhab.cfg for required configuration settings):"
oh1,action,pushover,true,Pushover,"The Pushover action service allows you to notify mobile devices of a message using the Pushover API web service."
oh1,action,pushsafer,false,Pushsafer,"The Pushsafer action allows you to notify iOS, Android & Windows 10 Phone & Desktop devices of a message using the Pushsafer API web service."
oh1,action,satel,false,Satel,"The Satel Action bundle provides actions to read the event log of the connected alarm system, check current connection status and override configured user code."
oh1,action,squeezebox,true,Squeezebox,"Interact directly with your Squeezebox devices from within rules and scripts."
oh1,action,telegram,false,Telegram,"The Telegram Action service allows sending formatted messages to Telegram clients ([https://telegram.org](https://telegram.org)), by using the Telegram Bot API."
oh1,action,tinkerforge,false,TinkerForge,"The TinkerForge Action service provides direct interaction with some of the TinkerForge devices."
oh1,action,twitter,true,Twitter,"Twitter can be used to 'tweet' notifications when certain events take place in openHAB."
oh1,action,weather,false,Weather,"The Weather Action service provides meteorological information to your scripts and rules."
oh1,action,xbmc,true,XBMC,"Sends notifications to the Kodi open source home theater software (formerly known as XBMC)."
oh1,action,xmpp,true,XMPP,"This set of actions allows you to send a message to an XMPP user or multi-user chat, or send a message with an attachment to an XMPP user."
oh1,action,xpl,false,xPL,"This add-on provides xPL message sending on the network."
oh1,persistence,caldav,false,CalDAV,"This binding can be used to connect through the CalDAV Interface to calendars."
oh1,persistence,cosm,false,Xively (formerly Cosm),"This service allows you to feed item states to the [Xively IoT Platform](https://www.xively.com/)."
oh1,persistence,db4o,false,db4o,"db4o is a pure Java object database, which uses a simple database file for persistence."
oh1,persistence,dynamodb,false,Amazon DynamoDB,"This service allows you to persist state updates using the [Amazon DynamoDB](https://aws.amazon.com/dynamodb/) database. Query functionality is also fully supported."
oh1,persistence,exec,false,Exec,"This service allows you to execute commands in the underlying OS to persist item states. It could be used to, for example, call the original `rrdtool` CLI tool."
oh1,persistence,influxdb,true,InfluxDB (0.9 and newer),"This service allows you to persist and query states using the [InfluxDB](http://influxdb.org) time series database. The persisted values can be queried from within openHAB. There also are nice tools on the web for visualizing InfluxDB time series, such as [Grafana](http://grafana.org/)."
oh1,persistence,influxdb08,false,InfluxDB (up to 0.8.x),"This service allows you to persist and query states using the [InfluxDB](http://influxdb.org) time series database. The persisted values can be queried from within openHAB. There also are nice tools on the web for visualizing InfluxDB time series, such as [Grafana](http://grafana.org/)."
oh1,persistence,jdbc,false,JDBC,"This service writes and reads item states to and from a number of relational database systems that support [Java Database Connectivity (JDBC)](https://en.wikipedia.org/wiki/Java_Database_Connectivity).  This service allows you to persist state updates using one of several different underlying database services. It is designed for a maximum of scalability, to store very large amounts of data and still over the years not lose its speed."
oh1,persistence,jpa,false,Java Persistence API (JPA),"This service allows you to persist state updates using a SQL or NoSQL database through the [Java Persistence API](https://en.wikipedia.org/wiki/Java_Persistence_API).  The service uses an abstraction layer that theoretically allows it to support many available SQL or NoSQL databases."
oh1,persistence,mapdb,false,mapdb,"The [mapdb](http://www.mapdb.org/) Persistence Service is based on simple key-value store that only saves the last value. The intention is to use this for `restoreOnStartup` items because all other persistence options have their drawbacks if values are only needed for reload.  They:"
oh1,persistence,mongodb,false,MongoDB,"This service allows you to persist state updates using the MongoDB database.  It supports writing information to a MongoDB document store, as well as querying from it."
oh1,persistence,mqtt,true,MQTT,"This service allows you to feed item states to an MQTT broker using the openHAB persistence strategies.  The destination broker, topic and messages are configurable."
oh1,persistence,mysql,false,MySQL,"This service allows you to persist state updates using the [MySQL](https://www.mysql.com/) database. Note that other SQL databases need a separate service due to incompatibilities between different SQL databases."
oh1,persistence,rrd4j,false,rrd4j,"The [rrd4j](https://github.com/rrd4j/rrd4j) Persistence service is based on a round-robin database."
oh1,persistence,sense,false,Sen.Se,"This service allows you to feed item data to [Sen.Se web site](http://open.sen.se)."
oh1,persistence,sitewhere,false,SiteWhere,"The [SiteWhere](http://www.sitewhere.org/) persistence service allows openHAB item states to be forwarded to a SiteWhere server instance running locally or in the cloud. Selected events from an openHAB instance can be stored in SiteWhere under a virtual device with hardware ID specified in the persistence provider implementation."
oh1,io,dropbox,true,Dropbox Synchronization,"This service will synchronize files on your openHAB server, such as configuration and log files, to and/or from your Dropbox account."
oh1,io,gcal,true,Google Calendar Scheduler,"The Google Calendar Scheduler allows you to control items in openHAB at scheduled times in the future.  It will send commands to items or update the state of items when defined on one of your Google Calendars."
oh2,io,homekit,false,HomeKit Add-on,"This is an add-on that exposes your openHAB system as a bridge over the HomeKit protocol."
oh2,io,hueemulation,false,openHAB Hue Emulation,"Hue Emulation exposes openHAB items as Hue devices to other Hue HTTP API compatible applications like an Amazon Echo."
oh2,io,imperihome,false,ImperiHome integration service,"This IO service exposes openHAB Items to the Evertygo [ImperiHome](http://www.evertygo.com/imperihome) dashboard app for Android and iOS."
oh2,io,openhabcloud,false,openHAB Cloud Connector,"The openHAB Cloud Connector allows connecting the local openHAB runtime to a remote [openHAB Cloud](https://github.com/openhab/openhab-cloud/blob/master/README.md) instance, such as [myopenHAB.org](http://www.myopenHAB.org), which is an instance of the"
oh2,voice,mactts,false,MacOS Text-to-Speech,"The MacOS Text-to-Speech (TTS) service uses the MacOS 'say' command for producing spoken text."
oh2,voice,marytts,false,Mary Text-to-Speech,"The Mary Text-to-Speech (TTS) service is a pure Java implementation of a TTS service, which uses the [MaryTTS](http://mary.dfki.de/) project of DFKI."
oh2,voice,voicerss,true,VoiceRSS Text-to-Speech,"VoiceRSS is an Internet based TTS service hosted at http://api.voicerss.org."
oh2,iconset,classic,false,Classic Icon Set,"This is a modernized version of the original icon set of openHAB 1.<br/><br/>"
oh2,ui,basic,false,Basic UI,"The Basic UI is a web interface based on Material Design Lite from Google."
oh2,ui,classic,false,Classic UI,"The Classic UI is the original web user interface of openHAB 1 and thus is the most stable and widely used UI as of today."
oh2,ui,paper,false,Paper UI,"The Paper UI is an HTML5 web application. The Paper UI implements Google's Material Design and is responsive, so that it smoothly renders on different screen sizes. All modern browsers (Safari, Chrome, Firefox) besides the Internet Explorer are supported in their newest version. The Internet Explorer is mainly lacking support for SSE."
oh2,ui,habmin,false,habmin,""
oh2,ui,habpanel,false,Configuration,"Unlike Basic UI and other interfaces, HABPanel doesn't use pre-configured sitemaps."
